<?xml version="1.0" encoding="UTF-8"?>

<!--
    Document   : newXMLDocument.xml
    Created on : May 19, 2009, 10:11 AM
    Author     : vds
    Description:
        Purpose of the document follows.
-->

<ns1:aspect  xmlns:xsi='http://www.w3.org/2001/XMLSchema-instance'
   xmlns:ns1='http://www.nebulon.com/xml/2004/fddi'
   xsi:schemaLocation='http://www.nebulon.com/xml/2004/fddi file:/Users/vds/Programming/Java/FDDTools%20Releases/Release%202.0/fddtools/fddi20060119.xsd' id="" anyAttribute= " ">
    <name></name>
    <info id="" anyAttribute= " ">
        <subjectName></subjectName>
        <activityName></activityName>
        <featureName></featureName>
        <milestoneName></milestoneName>
        <milestoneInfo id="" anyAttribute= " " effort="">
            <name></name>
        </milestoneInfo>
        <milestoneInfo id="" anyAttribute= " " effort="">
            <name></name>
        </milestoneInfo>
        <milestoneInfo id="" anyAttribute= " " effort="">
            <name></name>
        </milestoneInfo>
    </info>
    <subject id="" anyAttribute= " ">
        <prefix></prefix>
        <name></name>
        <activity id="" anyAttribute= " " target="">
            <name></name>
            <initials></initials>
            <feature id="" anyAttribute= " " seq="">
                <name></name>
                <initials></initials>
                <milestone id="" anyAttribute= " " planned="" actual="" status="">
                </milestone>
                <milestone id="" anyAttribute= " " planned="" actual="" status="">
                </milestone>
                <milestone id="" anyAttribute= " " planned="" actual="" status="">
                </milestone>
                <remarks id="" anyAttribute= " " entered="">
                    <initials></initials>
                </remarks>
                <remarks id="" anyAttribute= " " entered="">
                    <initials></initials>
                </remarks>
                <remarks id="" anyAttribute= " " entered="">
                    <initials></initials>
                </remarks>
                <ns1:progress id="" anyAttribute= " " count="1" completion="" status="">
                    <kpi status="" count=""></kpi>
                    <kpi status="" count=""></kpi>
                    <kpi status="" count=""></kpi>
                </ns1:progress>
            </feature>
            <feature id="" anyAttribute= " " seq="">
                <name></name>
                <initials></initials>
                <milestone id="" anyAttribute= " " planned="" actual="" status="">
                </milestone>
                <milestone id="" anyAttribute= " " planned="" actual="" status="">
                </milestone>
                <milestone id="" anyAttribute= " " planned="" actual="" status="">
                </milestone>
                <remarks id="" anyAttribute= " " entered="">
                    <initials></initials>
                </remarks>
                <remarks id="" anyAttribute= " " entered="">
                    <initials></initials>
                </remarks>
                <remarks id="" anyAttribute= " " entered="">
                    <initials></initials>
                </remarks>
                <ns1:progress id="" anyAttribute= " " count="1" completion="" status="">
                    <kpi status="" count=""></kpi>
                    <kpi status="" count=""></kpi>
                    <kpi status="" count=""></kpi>
                </ns1:progress>
            </feature>
            <feature id="" anyAttribute= " " seq="">
                <name></name>
                <initials></initials>
                <milestone id="" anyAttribute= " " planned="" actual="" status="">
                </milestone>
                <milestone id="" anyAttribute= " " planned="" actual="" status="">
                </milestone>
                <milestone id="" anyAttribute= " " planned="" actual="" status="">
                </milestone>
                <remarks id="" anyAttribute= " " entered="">
                    <initials></initials>
                </remarks>
                <remarks id="" anyAttribute= " " entered="">
                    <initials></initials>
                </remarks>
                <remarks id="" anyAttribute= " " entered="">
                    <initials></initials>
                </remarks>
                <ns1:progress id="" anyAttribute= " " count="1" completion="" status="">
                    <kpi status="" count=""></kpi>
                    <kpi status="" count=""></kpi>
                    <kpi status="" count=""></kpi>
                </ns1:progress>
            </feature>
            <ns1:progress id="" anyAttribute= " " count="1" completion="" status="">
                <kpi status="" count=""></kpi>
                <kpi status="" count=""></kpi>
                <kpi status="" count=""></kpi>
            </ns1:progress>
        </activity>
        <activity id="" anyAttribute= " " target="">
            <name></name>
            <initials></initials>
            <feature id="" anyAttribute= " " seq="">
                <name></name>
                <initials></initials>
                <milestone id="" anyAttribute= " " planned="" actual="" status="">
                </milestone>
                <milestone id="" anyAttribute= " " planned="" actual="" status="">
                </milestone>
                <milestone id="" anyAttribute= " " planned="" actual="" status="">
                </milestone>
                <remarks id="" anyAttribute= " " entered="">
                    <initials></initials>
                </remarks>
                <remarks id="" anyAttribute= " " entered="">
                    <initials></initials>
                </remarks>
                <remarks id="" anyAttribute= " " entered="">
                    <initials></initials>
                </remarks>
                <ns1:progress id="" anyAttribute= " " count="1" completion="" status="">
                    <kpi status="" count=""></kpi>
                    <kpi status="" count=""></kpi>
                    <kpi status="" count=""></kpi>
                </ns1:progress>
            </feature>
            <feature id="" anyAttribute= " " seq="">
                <name></name>
                <initials></initials>
                <milestone id="" anyAttribute= " " planned="" actual="" status="">
                </milestone>
                <milestone id="" anyAttribute= " " planned="" actual="" status="">
                </milestone>
                <milestone id="" anyAttribute= " " planned="" actual="" status="">
                </milestone>
                <remarks id="" anyAttribute= " " entered="">
                    <initials></initials>
                </remarks>
                <remarks id="" anyAttribute= " " entered="">
                    <initials></initials>
                </remarks>
                <remarks id="" anyAttribute= " " entered="">
                    <initials></initials>
                </remarks>
                <ns1:progress id="" anyAttribute= " " count="1" completion="" status="">
                    <kpi status="" count=""></kpi>
                    <kpi status="" count=""></kpi>
                    <kpi status="" count=""></kpi>
                </ns1:progress>
            </feature>
            <feature id="" anyAttribute= " " seq="">
                <name></name>
                <initials></initials>
                <milestone id="" anyAttribute= " " planned="" actual="" status="">
                </milestone>
                <milestone id="" anyAttribute= " " planned="" actual="" status="">
                </milestone>
                <milestone id="" anyAttribute= " " planned="" actual="" status="">
                </milestone>
                <remarks id="" anyAttribute= " " entered="">
                    <initials></initials>
                </remarks>
                <remarks id="" anyAttribute= " " entered="">
                    <initials></initials>
                </remarks>
                <remarks id="" anyAttribute= " " entered="">
                    <initials></initials>
                </remarks>
                <ns1:progress id="" anyAttribute= " " count="1" completion="" status="">
                    <kpi status="" count=""></kpi>
                    <kpi status="" count=""></kpi>
                    <kpi status="" count=""></kpi>
                </ns1:progress>
            </feature>
            <ns1:progress id="" anyAttribute= " " count="1" completion="" status="">
                <kpi status="" count=""></kpi>
                <kpi status="" count=""></kpi>
                <kpi status="" count=""></kpi>
            </ns1:progress>
        </activity>
        <activity id="" anyAttribute= " " target="">
            <name></name>
            <initials></initials>
            <feature id="" anyAttribute= " " seq="">
                <name></name>
                <initials></initials>
                <milestone id="" anyAttribute= " " planned="" actual="" status="">
                </milestone>
                <milestone id="" anyAttribute= " " planned="" actual="" status="">
                </milestone>
                <milestone id="" anyAttribute= " " planned="" actual="" status="">
                </milestone>
                <remarks id="" anyAttribute= " " entered="">
                    <initials></initials>
                </remarks>
                <remarks id="" anyAttribute= " " entered="">
                    <initials></initials>
                </remarks>
                <remarks id="" anyAttribute= " " entered="">
                    <initials></initials>
                </remarks>
                <ns1:progress id="" anyAttribute= " " count="1" completion="" status="">
                    <kpi status="" count=""></kpi>
                    <kpi status="" count=""></kpi>
                    <kpi status="" count=""></kpi>